{
  "kode_ahsp": "3.1.2",
  "nama": "Galian Batu",
  "bidang": "bina-marga",
  "divisi": 3,
  "sub_divisi": "3.1",
  "satuan_bayar": "m3",
  "jenis_kalkulasi": "dynamic_hsd",
  "volume_state_bayar": "bank",
  "jenis_pekerjaan": "mekanis",
  "is_lump_sum": false,
  "sub_ahsp": [],
  "tenaga_kerja": [
    {
      "ref": "L.01",
      "koefisien": 0.1,
      "koef_sumber": "tabel",
      "catatan": "Lebih tinggi dari galian biasa karena material keras",
      "nama": "Pekerja"
    },
    {
      "ref": "L.04",
      "koefisien": 0.03,
      "koef_sumber": "tabel",
      "catatan": null,
      "nama": "Mandor"
    }
  ],
  "bahan": [],
  "peralatan": [
    {
      "ref": "E.01",
      "nama": "Excavator PC-200",
      "koef_sumber": "kalkulasi",
      "mode_biaya": "ownership",
      "volume_state": "bank",
      "variabel_input": [
        "jenis_material"
      ],
      "koef_referensi": {
        "value": 0.0135,
        "asumsi": {
          "fa": 0.83,
          "jenis_material": "batu_pecah",
          "kapasitas_bucket_m3": 0.93,
          "waktu_siklus_menit": 0.65
        }
      },
      "catatan": "Produktivitas lebih rendah karena material keras, waktu siklus lebih lama"
    },
    {
      "ref": "E.08",
      "nama": "Dump Truck 12 Ton",
      "koef_sumber": "kalkulasi",
      "mode_biaya": "ownership",
      "volume_state": "loose",
      "variabel_input": [
        "jarak_buang_km",
        "kondisi_jalan"
      ],
      "koef_referensi": null,
      "catatan": "Koefisien tergantung jarak buang"
    }
  ],
  "variabel": {
    "jarak_buang_km": {
      "label": "Jarak Buang Material",
      "satuan": "km",
      "tipe": "number",
      "required": true,
      "default": null,
      "min": 0.5,
      "max": 100
    },
    "kondisi_jalan": {
      "label": "Kondisi Jalan Hauling",
      "tipe": "enum",
      "options": [
        "baik",
        "sedang"
      ],
      "default": "sedang"
    },
    "jenis_material": {
      "label": "Jenis Material Galian",
      "tipe": "enum",
      "options": [
        "batu_pecah",
        "batu_kapur",
        "batu_keras"
      ],
      "default": "batu_pecah"
    },
    "faktor_efisiensi": {
      "label": "Faktor Efisiensi Alat (Fa)",
      "tipe": "number",
      "default": 0.83,
      "min": 0.6,
      "max": 0.9
    },
    "kondisi_operasi": {
      "label": "Kondisi Operasi (untuk Fpr)",
      "tipe": "enum",
      "options": [
        "normal",
        "berat",
        "sangat_berat"
      ],
      "default": "berat"
    }
  },
  "margin": {
    "overhead_pct": {
      "label": "Biaya Umum (Overhead)",
      "min": 0,
      "max": 15,
      "default": 10
    },
    "profit_pct": {
      "label": "Keuntungan (Profit)",
      "min": 0,
      "max": 15,
      "default": 5
    },
    "constraint": {
      "rule": "10 <= overhead_pct + profit_pct <= 15"
    }
  },
  "provenance": {
    "sumber_regulasi": "Permen PUPR 8/2023 Lampiran III Bina Marga",
    "halaman": "III-14",
    "diverifikasi_oleh": null,
    "tanggal_verifikasi": null,
    "verification_tier": "auto-extracted"
  },
  "catatan_umum": [
    "Volume dibayar dalam m3 bank (galian asli)",
    "Galian batu memerlukan produktivitas yang lebih rendah dari galian biasa",
    "Dump Truck koefisien WAJIB dihitung berdasarkan jarak buang aktual",
    "Kondisi operasi default berat karena material keras"
  ]
}
